{
  "kind": "compile-and-run",
  "sample": "samples/net11.0/PacketLayout/PacketLayout.csproj",
  "target": "net11.0",
  "sdk": "11.0.100-rc.2.26504.105",
  "language": "15.0",
  "command": "C:/Users/pingu/.dotnet-playbook-11/dotnet.exe build PacketLayout.csproj --configuration Release -p:RestoreLockedMode=true; C:/Users/pingu/.dotnet-playbook-11/dotnet.exe V:\\_worktrees\\Playbook\\t3-8780a32c\\samples\\net11.0\\PacketLayout\\bin\\Release\\net11.0\\PacketLayout.dll",
  "scope": "See recipe scope; output records only the commands actually performed.",
  "recordedAt": "2026-10-30T19:06:12.1939954+00:00",
  "sourceCommit": "b157cc99c5366c43fe42232be760085c378262a0",
  "sourceDirty": true,
  "inputs": {
    "eng/Evidence.ps1": "b3dbd6b3788e31aefe1533ef89fed66625f2a637993f9291e8d1d4fc8a2ba849",
    "eng/Record-Evidence.ps1": "653a32b1ebe5be60a5489afd9a7a963dbbabf5c2ecfd47fe480974fd5d939498",
    "eng/Test-CompilerInspections.ps1": "fa2f08eb5917abb7e5d7971bc59e62dd5856d55465b499fea3f5f69c10f617db",
    "samples/CompilerInspections/ReadIl.cs": "784b22e4dd3899dedfe869dbfd62cddc94ae392798655c05ca7b4b7401c0f04a",
    "samples/Directory.Build.props": "ac524510d3e5112332f8c69b4c7b367c90642848dfd249163bd084405502def6",
    "samples/Directory.Build.targets": "17284cb74605517cbec8a8153505da71a685b28694b67b5ef80608cd79b1c0ea",
    "samples/net11.0/PacketLayout/Directory.Packages.props": "7432987ccc32440f8b38a0675bf6f9dd88d7647a1a4471a54af7103e55974a8c",
    "samples/net11.0/PacketLayout/global.json": "99e21c134d643fe49fe2df0d5c3b961f91c7ffe806ab12033266c7203b457116",
    "samples/net11.0/PacketLayout/NuGet.Config": "2e4afdd5cd1d2c64284579806ca6acee19b4373e1369fb6987f264ba0b902ba7",
    "samples/net11.0/PacketLayout/packages.lock.json": "a2bc9db4e277afe1f8796db0be02ada10b08e0c24a8d4c0c2ac33fb501adbdda",
    "samples/net11.0/PacketLayout/PacketLayout.csproj": "cfd09b76ee98c356a5059958689296766f7c33360c190a37eb8b8aac7e179b36",
    "samples/net11.0/PacketLayout/Packets.cs": "e18307c26a152c2bdb344473954e516357c0ef3d332869fda23c96d58f67976a",
    "samples/net11.0/PacketLayout/verification.json": "1cc7490993f11e571ac149c39cb102b3c9f4235c441eb852d4ce5b7e56ce0509"
  },
  "dependencies": [
    "Microsoft.CodeAnalysis.Analyzers/5.12.0-1.26465.4",
    "Microsoft.CodeAnalysis.Common/5.12.0-1.26504.105",
    "Microsoft.CodeAnalysis.CSharp/5.12.0-1.26504.105"
  ],
  "workloads": [],
  "nativeToolchains": [],
  "host": "Microsoft Windows 10.0.26200 / X64",
  "sdkInfo": ".NET SDK:\r\n Version:           11.0.100-rc.2.26504.105\r\n Commit:            820230c386\r\n Workload version:  11.0.100-manifests.4d7a54d2\r\n MSBuild version:   18.12.0-1.26504.105+820230c38\r\n\r\nRuntime Environment:\r\n OS Name:     Windows\r\n OS Version:  10.0.26200\r\n OS Platform: Windows\r\n RID:         win-x64\r\n Base Path:   C:\\Users\\pingu\\.dotnet-playbook-11\\sdk\\11.0.100-rc.2.26504.105\r\n\r\n.NET workloads installed:\r\n [wasm-tools]\r\n   Installation Source: VS 18.11.12306.390\r\n   Manifest Version:    11.0.100-rc.2.26504.105/11.0.100-rc.2\r\n   Manifest Path:       C:\\Users\\pingu\\.dotnet-playbook-11\\sdk-manifests\\11.0.100-rc.2\\microsoft.net.workload.mono.toolchain.current\\11.0.100-rc.2.26504.105\\WorkloadManifest.json\r\n   Install Type:        FileBased\r\n\r\n [maui-windows]\r\n   Installation Source: VS 18.11.12306.390\r\n   Manifest Version:    11.0.0-preview.6.26360.8/11.0.100-preview.6\r\n   Manifest Path:       C:\\Users\\pingu\\.dotnet-playbook-11\\sdk-manifests\\11.0.100-preview.6\\microsoft.net.sdk.maui\\11.0.0-preview.6.26360.8\\WorkloadManifest.json\r\n   Install Type:        FileBased\r\n\r\n [maccatalyst]\r\n   Installation Source: VS 18.11.12306.390\r\n   Manifest Version:    26.5.11720-net11-p6/11.0.100-preview.6\r\n   Manifest Path:       C:\\Users\\pingu\\.dotnet-playbook-11\\sdk-manifests\\11.0.100-preview.6\\microsoft.net.sdk.maccatalyst\\26.5.11720-net11-p6\\WorkloadManifest.json\r\n   Install Type:        FileBased\r\n\r\n [ios]\r\n   Installation Source: VS 18.11.12306.390\r\n   Manifest Version:    26.5.11720-net11-p6/11.0.100-preview.6\r\n   Manifest Path:       C:\\Users\\pingu\\.dotnet-playbook-11\\sdk-manifests\\11.0.100-preview.6\\microsoft.net.sdk.ios\\26.5.11720-net11-p6\\WorkloadManifest.json\r\n   Install Type:        FileBased\r\n\r\n [android]\r\n   Installation Source: VS 18.11.12306.390\r\n   Manifest Version:    37.0.0-preview.6.59/11.0.100-preview.6\r\n   Manifest Path:       C:\\Users\\pingu\\.dotnet-playbook-11\\sdk-manifests\\11.0.100-preview.6\\microsoft.net.sdk.android\\37.0.0-preview.6.59\\WorkloadManifest.json\r\n   Install Type:        FileBased\r\n\r\nConfigured to use workload sets when installing new manifests.\r\nNo workload sets are installed. Run \"dotnet workload restore\" to install a workload set.\r\n\r\nHost:\r\n  Version:      11.0.0-rc.2.26504.105\r\n  Architecture: x64\r\n  Commit:       820230c386\r\n\r\n.NET SDKs installed:\r\n  11.0.100-rc.2.26504.105 [C:\\Users\\pingu\\.dotnet-playbook-11\\sdk]\r\n\r\n.NET runtimes installed:\r\n  Microsoft.AspNetCore.App 11.0.0-rc.2.26504.105 [C:\\Users\\pingu\\.dotnet-playbook-11\\shared\\Microsoft.AspNetCore.App]\r\n  Microsoft.NETCore.App 11.0.0-rc.2.26504.105 [C:\\Users\\pingu\\.dotnet-playbook-11\\shared\\Microsoft.NETCore.App]\r\n  Microsoft.WindowsDesktop.App 11.0.0-rc.2.26504.105 [C:\\Users\\pingu\\.dotnet-playbook-11\\shared\\Microsoft.WindowsDesktop.App]\r\n\r\nOther architectures found:\r\n  x86   [C:\\Program Files (x86)\\dotnet]\r\n    registered at [HKLM\\SOFTWARE\\dotnet\\Setup\\InstalledVersions\\x86\\InstallLocation]\r\n\r\nEnvironment variables:\r\n  DOTNET_ADD_GLOBAL_TOOLS_TO_PATH          [0]\r\n  DOTNET_ROOT                              [C:\\Users\\pingu\\AppData\\Local\\dotnetup\\dotnet]\r\n\r\nglobal.json file:\r\n  V:\\_worktrees\\Playbook\\t3-8780a32c\\samples\\net11.0\\PacketLayout\\global.json\r\n\r\nLearn more:\r\n  https://aka.ms/dotnet/info\r\n\r\nDownload .NET:\r\n  https://aka.ms/dotnet/download",
  "workloadInfo": "Workload version: 11.0.100-manifests.4d7a54d2\r\n\r\nInstalled Workload Id      Manifest Version                                 Installation Source\r\n-----------------------------------------------------------------------------------------------\r\nandroid                    37.0.0-preview.6.59/11.0.100-preview.6           VS 18.11.12306.390 \r\nios                        26.5.11720-net11-p6/11.0.100-preview.6           VS 18.11.12306.390 \r\nmaccatalyst                26.5.11720-net11-p6/11.0.100-preview.6           VS 18.11.12306.390 \r\nmaui-windows               11.0.0-preview.6.26360.8/11.0.100-preview.6      VS 18.11.12306.390 \r\nwasm-tools                 11.0.100-rc.2.26504.105/11.0.100-rc.2            VS 18.11.12306.390 \r\n\r\nUse `dotnet workload search` to find additional workloads to install.",
  "output": "Determining projects to restore...\r\n  All projects are up-to-date for restore.\r\nC:\\Users\\pingu\\.dotnet-playbook-11\\sdk\\11.0.100-rc.2.26504.105\\Sdks\\Microsoft.NET.Sdk\\targets\\Microsoft.NET.RuntimeIdentifierInference.targets(385,5): message NETSDK1057: You are using a preview version of .NET. See: https://aka.ms/dotnet-support-policy [V:\\_worktrees\\Playbook\\t3-8780a32c\\samples\\net11.0\\PacketLayout\\PacketLayout.csproj]\r\n  PacketLayout -> V:\\_worktrees\\Playbook\\t3-8780a32c\\samples\\net11.0\\PacketLayout\\bin\\Release\\net11.0\\PacketLayout.dll\r\n\r\nBuild succeeded.\r\n    0 Warning(s)\r\n    0 Error(s)\r\n\r\nTime Elapsed 00:00:00.25\nSeedPacket: (Sequential, 2, 24) PASS\r\nSensorPacket: (Explicit, 1, 32) PASS\r\nWorkPacket: (Auto, 0, 0) PASS\r\nRuntime=11.0.0; Roslyn=Microsoft.CodeAnalysis, Version=5.12.0.0, Culture=neutral, PublicKeyToken=31bf3856ad364e35"
}
