{
  "kind": "compile",
  "sample": "samples/net10.0/SeedLabels/SeedLabels.csproj",
  "target": "net10.0",
  "sdk": "10.0.402",
  "language": "14.0",
  "command": "C:\\Program Files\\dotnet\\dotnet.exe build SeedLabels.csproj --configuration Release -p:RestoreLockedMode=true",
  "scope": "See recipe scope; output records only the commands actually performed.",
  "recordedAt": "2026-10-23T00:34:51.3612622+00:00",
  "sourceCommit": "ff90b07cf9524ce73a39613553790042e6e66e02",
  "sourceDirty": true,
  "inputs": {
    ".editorconfig": "c99359640a7ebc05cb7e8246fa002e9cd12b3b10bc7773f1af574391e8e94664",
    "eng/Evidence.ps1": "b3dbd6b3788e31aefe1533ef89fed66625f2a637993f9291e8d1d4fc8a2ba849",
    "eng/Record-Evidence.ps1": "653a32b1ebe5be60a5489afd9a7a963dbbabf5c2ecfd47fe480974fd5d939498",
    "NuGet.Config": "aec93b5637ab6d62470979a008990a4a336a287ab83a3f2541849ae735674055",
    "samples/Directory.Build.props": "ac524510d3e5112332f8c69b4c7b367c90642848dfd249163bd084405502def6",
    "samples/Directory.Build.targets": "17284cb74605517cbec8a8153505da71a685b28694b67b5ef80608cd79b1c0ea",
    "samples/Directory.Packages.props": "7209dd1e4245a84c619bada1f05c2505db0eb84ee6123af21759267b9c7e36a1",
    "samples/net10.0/SeedLabels/_Imports.razor": "389fed22a13757a9ae331e34a02fb89b779521f4b0922e36529de550905d396a",
    "samples/net10.0/SeedLabels/App.razor": "b39b70f0269138b7659248465ebce451f3f75537d680f31be610c69aba7544f8",
    "samples/net10.0/SeedLabels/BatchPanel.razor": "2cff7e32166fcde1edc8675c3e5fd27e36b393e272b7c18637800f5f285148b4",
    "samples/net10.0/SeedLabels/Choices.cs": "d9cb96a486edcd6224e068943d3d4caa1da512ae6532ee491b3b46960ea3d589",
    "samples/net10.0/SeedLabels/global.json": "d1bb820bf074027be921b263729d1fba343d34328f0c4b7484d10162287c059e",
    "samples/net10.0/SeedLabels/Labels.razor": "c02b49d1114846e9f27691467aaf84932a91c5f55bfa7908cfc7200f9c2eaa08",
    "samples/net10.0/SeedLabels/packages.lock.json": "82607bfa04714b032a0a88029715156fe4e1cf7b3b424d295b4f834c2e1644a8",
    "samples/net10.0/SeedLabels/Program.cs": "ea9df704a1fd0dfea61bc0f49a83639eccfb4bbdd184db7417d09c51263be499",
    "samples/net10.0/SeedLabels/SeedBadge.razor": "0e45598937843cd8e9029c57dc98a399c956ccfeb711c7ff5b8358960b48623f",
    "samples/net10.0/SeedLabels/SeedLabels.csproj": "ba70bc19b1547fa1bed644c27fffa0ca522790352eea830e673e9aef23838819",
    "samples/net10.0/SeedLabels/verification.json": "d293f0e3b42c0c91cdd6ea0ac22565ee7daa9226328425d7a17b1ebded54dc2f",
    "samples/net10.0/SeedLabels/wwwroot/seed.js": "8b1256b775bc866a6048daa2a2230182a7a56d7c4409dd8dd1550ed9e3b3769d",
    "samples/SeedLabelsChecks.ps1": "f55ef1aef6fba1b07a6ae25a6e55d621d58b9b76e6321ebf23f989f4de3ec7e4"
  },
  "dependencies": [
    "Microsoft.AspNetCore.App.Internal.Assets/10.0.13"
  ],
  "workloads": [],
  "nativeToolchains": [],
  "host": "Microsoft Windows 10.0.26200 / X64",
  "sdkInfo": ".NET SDK:\r\n Version:           10.0.402\r\n Commit:            a8dd0577c5\r\n Workload version:  10.0.400-manifests.6055ec36\r\n MSBuild version:   18.9.15+a8dd0577c\r\n\r\nRuntime Environment:\r\n OS Name:     Windows\r\n OS Version:  10.0.26200\r\n OS Platform: Windows\r\n RID:         win-x64\r\n Base Path:   C:\\Program Files\\dotnet\\sdk\\10.0.402\\\r\n\r\n.NET workloads installed:\r\n [wasm-tools]\r\n   Installation Source: VS 18.11.12306.390\r\n   Manifest Version:    10.0.113/10.0.100\r\n   Manifest Path:       C:\\Program Files\\dotnet\\sdk-manifests\\10.0.100\\microsoft.net.workload.mono.toolchain.current\\10.0.113\\WorkloadManifest.json\r\n   Install Type:              Msi\r\n\r\n [maui-windows]\r\n   Installation Source: VS 18.11.12306.390\r\n   Manifest Version:    10.0.110/10.0.100\r\n   Manifest Path:       C:\\Program Files\\dotnet\\sdk-manifests\\10.0.100\\microsoft.net.sdk.maui\\10.0.110\\WorkloadManifest.json\r\n   Install Type:              Msi\r\n\r\n [maccatalyst]\r\n   Installation Source: VS 18.11.12306.390\r\n   Manifest Version:    26.5.10315/10.0.100\r\n   Manifest Path:       C:\\Program Files\\dotnet\\sdk-manifests\\10.0.100\\microsoft.net.sdk.maccatalyst\\26.5.10315\\WorkloadManifest.json\r\n   Install Type:              Msi\r\n\r\n [ios]\r\n   Installation Source: VS 18.11.12306.390\r\n   Manifest Version:    26.5.10315/10.0.100\r\n   Manifest Path:       C:\\Program Files\\dotnet\\sdk-manifests\\10.0.100\\microsoft.net.sdk.ios\\26.5.10315\\WorkloadManifest.json\r\n   Install Type:              Msi\r\n\r\n [android]\r\n   Installation Source: VS 18.11.12306.390\r\n   Manifest Version:    36.1.118/10.0.100\r\n   Manifest Path:       C:\\Program Files\\dotnet\\sdk-manifests\\10.0.100\\microsoft.net.sdk.android\\36.1.118\\WorkloadManifest.json\r\n   Install Type:              Msi\r\n\r\nConfigured to use workload sets when installing new manifests.\r\nNo workload sets are installed. Run \"dotnet workload restore\" to install a workload set.\r\n\r\nHost:\r\n  Version:      10.0.13\r\n  Architecture: x64\r\n  Commit:       4099f83977\r\n\r\n.NET SDKs installed:\r\n  10.0.300 [C:\\Program Files\\dotnet\\sdk]\r\n  10.0.402 [C:\\Program Files\\dotnet\\sdk]\r\n\r\n.NET runtimes installed:\r\n  Microsoft.AspNetCore.App 10.0.8 [C:\\Program Files\\dotnet\\shared\\Microsoft.AspNetCore.App]\r\n  Microsoft.AspNetCore.App 10.0.13 [C:\\Program Files\\dotnet\\shared\\Microsoft.AspNetCore.App]\r\n  Microsoft.NETCore.App 10.0.8 [C:\\Program Files\\dotnet\\shared\\Microsoft.NETCore.App]\r\n  Microsoft.NETCore.App 10.0.13 [C:\\Program Files\\dotnet\\shared\\Microsoft.NETCore.App]\r\n  Microsoft.WindowsDesktop.App 10.0.8 [C:\\Program Files\\dotnet\\shared\\Microsoft.WindowsDesktop.App]\r\n  Microsoft.WindowsDesktop.App 10.0.13 [C:\\Program Files\\dotnet\\shared\\Microsoft.WindowsDesktop.App]\r\n\r\nOther architectures found:\r\n  x86   [C:\\Program Files (x86)\\dotnet]\r\n    registered at [HKLM\\SOFTWARE\\dotnet\\Setup\\InstalledVersions\\x86\\InstallLocation]\r\n\r\nEnvironment variables:\r\n  DOTNET_ADD_GLOBAL_TOOLS_TO_PATH          [0]\r\n\r\nglobal.json file:\r\n  V:\\_worktrees\\Playbook\\agent-pin-779-04-007-offer-a-single-parameter-for-alternative-ui-values\\samples\\net10.0\\SeedLabels\\global.json\r\n\r\nLearn more:\r\n  https://aka.ms/dotnet/info\r\n\r\nDownload .NET:\r\n  https://aka.ms/dotnet/download",
  "workloadInfo": "Workload version: 10.0.400-manifests.6055ec36\r\n\r\nInstalled Workload Id      Manifest Version         Installation Source\r\n-----------------------------------------------------------------------\r\nandroid                    36.1.118/10.0.100        VS 18.11.12306.390 \r\nios                        26.5.10315/10.0.100      VS 18.11.12306.390 \r\nmaccatalyst                26.5.10315/10.0.100      VS 18.11.12306.390 \r\nmaui-windows               10.0.110/10.0.100        VS 18.11.12306.390 \r\nwasm-tools                 10.0.113/10.0.100        VS 18.11.12306.390 \r\n\r\nUse `dotnet workload search` to find additional workloads to install.",
  "output": "Determining projects to restore...\r\n  All projects are up-to-date for restore.\r\n  SeedLabels -> V:\\_worktrees\\Playbook\\agent-pin-779-04-007-offer-a-single-parameter-for-alternative-ui-values\\samples\\net10.0\\SeedLabels\\bin\\Release\\net10.0\\SeedLabels.dll\r\n\r\nBuild succeeded.\r\n    0 Warning(s)\r\n    0 Error(s)\r\n\r\nTime Elapsed 00:00:02.22"
}
