{
  "kind": "compile-and-run",
  "sample": "samples/net10.0/PackageTimestamps/PackageTimestamps.csproj",
  "target": "net10.0",
  "sdk": "10.0.402",
  "language": "14.0",
  "command": "C:\\Program Files\\dotnet\\dotnet.exe build PackageTimestamps.csproj --configuration Release -p:RestoreLockedMode=true; C:\\Program Files\\dotnet\\dotnet.exe C:\\Users\\pingu\\.t3\\scratch\\2026-10-22-implement-task-linear-pin-770-0c2706c0\\samples\\net10.0\\PackageTimestamps\\bin\\Release\\net10.0\\PackageTimestamps.dll",
  "scope": "See recipe scope; output records only the commands actually performed.",
  "recordedAt": "2026-10-22T15:27:49.8921725+00:00",
  "sourceCommit": "47b6f24809d540f9473bbfdc8cf9d22f70bf501a",
  "sourceDirty": true,
  "inputs": {
    "eng/Evidence.ps1": "b3dbd6b3788e31aefe1533ef89fed66625f2a637993f9291e8d1d4fc8a2ba849",
    "eng/Record-Evidence.ps1": "653a32b1ebe5be60a5489afd9a7a963dbbabf5c2ecfd47fe480974fd5d939498",
    "NuGet.Config": "aec93b5637ab6d62470979a008990a4a336a287ab83a3f2541849ae735674055",
    "samples/Directory.Build.props": "ac524510d3e5112332f8c69b4c7b367c90642848dfd249163bd084405502def6",
    "samples/Directory.Build.targets": "17284cb74605517cbec8a8153505da71a685b28694b67b5ef80608cd79b1c0ea",
    "samples/Directory.Packages.props": "7209dd1e4245a84c619bada1f05c2505db0eb84ee6123af21759267b9c7e36a1",
    "samples/net10.0/PackageTimestamps/global.json": "30fdf1d1d5cfadd6447ab39d18cc5eec405cf1a5ec5b2e4b1d228a6fe757846d",
    "samples/net10.0/PackageTimestamps/Normalize.cs": "660f068596193b18a4921edbed4d9364846010b25bc90574835f87344945dbd0",
    "samples/net10.0/PackageTimestamps/PackageTimestamps.csproj": "eaa578f07b3115e825903296fcc946fb6cd11de931f32f2e2099475e141c3f2e",
    "samples/net10.0/PackageTimestamps/TimestampPolicy.props": "31d3e9c8ac4cd045a330f62ab11b1c581a0694c32857c18475cd3c1e294fd3e2",
    "samples/net10.0/PackageTimestamps/verification.json": "965025c3d6d7d07614272f575e2835651ba89d66e82d90cba4b8ded484c87a06",
    "samples/PackageTimestampChecks.cs": "59cb7b9f4c43b6c0357aa018230c9caf2d1a8207815a37c5989aaee68c7e2a8f",
    "samples/PolicyCommand.cs": "770aa5706dad1c324a6e83bd988de9c5d7b9c34b5474ccf5df30b3b1246920f0"
  },
  "dependencies": [],
  "workloads": [],
  "nativeToolchains": [],
  "host": "Microsoft Windows 10.0.26200 / X64",
  "sdkInfo": ".NET SDK:\r\n Version:           10.0.402\r\n Commit:            a8dd0577c5\r\n Workload version:  10.0.400-manifests.6055ec36\r\n MSBuild version:   18.9.15+a8dd0577c\r\n\r\nRuntime Environment:\r\n OS Name:     Windows\r\n OS Version:  10.0.26200\r\n OS Platform: Windows\r\n RID:         win-x64\r\n Base Path:   C:\\Program Files\\dotnet\\sdk\\10.0.402\\\r\n\r\n.NET workloads installed:\r\n [wasm-tools]\r\n   Installation Source: VS 18.11.12306.390\r\n   Manifest Version:    10.0.113/10.0.100\r\n   Manifest Path:       C:\\Program Files\\dotnet\\sdk-manifests\\10.0.100\\microsoft.net.workload.mono.toolchain.current\\10.0.113\\WorkloadManifest.json\r\n   Install Type:              Msi\r\n\r\n [maui-windows]\r\n   Installation Source: VS 18.11.12306.390\r\n   Manifest Version:    10.0.110/10.0.100\r\n   Manifest Path:       C:\\Program Files\\dotnet\\sdk-manifests\\10.0.100\\microsoft.net.sdk.maui\\10.0.110\\WorkloadManifest.json\r\n   Install Type:              Msi\r\n\r\n [maccatalyst]\r\n   Installation Source: VS 18.11.12306.390\r\n   Manifest Version:    26.5.10315/10.0.100\r\n   Manifest Path:       C:\\Program Files\\dotnet\\sdk-manifests\\10.0.100\\microsoft.net.sdk.maccatalyst\\26.5.10315\\WorkloadManifest.json\r\n   Install Type:              Msi\r\n\r\n [ios]\r\n   Installation Source: VS 18.11.12306.390\r\n   Manifest Version:    26.5.10315/10.0.100\r\n   Manifest Path:       C:\\Program Files\\dotnet\\sdk-manifests\\10.0.100\\microsoft.net.sdk.ios\\26.5.10315\\WorkloadManifest.json\r\n   Install Type:              Msi\r\n\r\n [android]\r\n   Installation Source: VS 18.11.12306.390\r\n   Manifest Version:    36.1.118/10.0.100\r\n   Manifest Path:       C:\\Program Files\\dotnet\\sdk-manifests\\10.0.100\\microsoft.net.sdk.android\\36.1.118\\WorkloadManifest.json\r\n   Install Type:              Msi\r\n\r\nConfigured to use workload sets when installing new manifests.\r\nNo workload sets are installed. Run \"dotnet workload restore\" to install a workload set.\r\n\r\nHost:\r\n  Version:      10.0.13\r\n  Architecture: x64\r\n  Commit:       4099f83977\r\n\r\n.NET SDKs installed:\r\n  10.0.300 [C:\\Program Files\\dotnet\\sdk]\r\n  10.0.402 [C:\\Program Files\\dotnet\\sdk]\r\n\r\n.NET runtimes installed:\r\n  Microsoft.AspNetCore.App 10.0.8 [C:\\Program Files\\dotnet\\shared\\Microsoft.AspNetCore.App]\r\n  Microsoft.AspNetCore.App 10.0.13 [C:\\Program Files\\dotnet\\shared\\Microsoft.AspNetCore.App]\r\n  Microsoft.NETCore.App 10.0.8 [C:\\Program Files\\dotnet\\shared\\Microsoft.NETCore.App]\r\n  Microsoft.NETCore.App 10.0.13 [C:\\Program Files\\dotnet\\shared\\Microsoft.NETCore.App]\r\n  Microsoft.WindowsDesktop.App 10.0.8 [C:\\Program Files\\dotnet\\shared\\Microsoft.WindowsDesktop.App]\r\n  Microsoft.WindowsDesktop.App 10.0.13 [C:\\Program Files\\dotnet\\shared\\Microsoft.WindowsDesktop.App]\r\n\r\nOther architectures found:\r\n  x86   [C:\\Program Files (x86)\\dotnet]\r\n    registered at [HKLM\\SOFTWARE\\dotnet\\Setup\\InstalledVersions\\x86\\InstallLocation]\r\n\r\nEnvironment variables:\r\n  DOTNET_ADD_GLOBAL_TOOLS_TO_PATH          [0]\r\n\r\nglobal.json file:\r\n  C:\\Users\\pingu\\.t3\\scratch\\2026-10-22-implement-task-linear-pin-770-0c2706c0\\samples\\net10.0\\PackageTimestamps\\global.json\r\n\r\nLearn more:\r\n  https://aka.ms/dotnet/info\r\n\r\nDownload .NET:\r\n  https://aka.ms/dotnet/download",
  "workloadInfo": "Workload version: 10.0.400-manifests.6055ec36\r\n\r\nInstalled Workload Id      Manifest Version         Installation Source\r\n-----------------------------------------------------------------------\r\nandroid                    36.1.118/10.0.100        VS 18.11.12306.390 \r\nios                        26.5.10315/10.0.100      VS 18.11.12306.390 \r\nmaccatalyst                26.5.10315/10.0.100      VS 18.11.12306.390 \r\nmaui-windows               10.0.110/10.0.100        VS 18.11.12306.390 \r\nwasm-tools                 10.0.113/10.0.100        VS 18.11.12306.390 \r\n\r\nUse `dotnet workload search` to find additional workloads to install.",
  "output": "Determining projects to restore...\r\n  All projects are up-to-date for restore.\r\n  PackageTimestamps -> C:\\Users\\pingu\\.t3\\scratch\\2026-10-22-implement-task-linear-pin-770-0c2706c0\\samples\\net10.0\\PackageTimestamps\\bin\\Release\\net10.0\\PackageTimestamps.dll\r\n\r\nBuild succeeded.\r\n    0 Warning(s)\r\n    0 Error(s)\r\n\r\nTime Elapsed 00:00:01.39\nC:\\Program Files\\dotnet\\dotnet.exe pack Depot.csproj -c Release -o C:\\Users\\pingu\\AppData\\Local\\Temp\\playbook-timestamps-8e1f6d7062914d09bc90f546c5cb644d\\repeat-a\r\nexit=0\r\n  Determining projects to restore...\r\n  Restored C:\\Users\\pingu\\AppData\\Local\\Temp\\playbook-timestamps-8e1f6d7062914d09bc90f546c5cb644d\\Depot.csproj (in 64 ms).\r\n  Depot -> C:\\Users\\pingu\\AppData\\Local\\Temp\\playbook-timestamps-8e1f6d7062914d09bc90f546c5cb644d\\bin\\Release\\net10.0\\Depot.dll\r\n  The package Depot.Manifest.1.0.0 is missing a readme. Go to https://aka.ms/nuget/authoring-best-practices/readme to learn why package readmes are important.\r\n  Successfully created package 'C:\\Users\\pingu\\AppData\\Local\\Temp\\playbook-timestamps-8e1f6d7062914d09bc90f546c5cb644d\\repeat-a\\Depot.Manifest.1.0.0.nupkg'.\r\n\r\nC:\\Program Files\\dotnet\\dotnet.exe pack Depot.csproj -c Release -o C:\\Users\\pingu\\AppData\\Local\\Temp\\playbook-timestamps-8e1f6d7062914d09bc90f546c5cb644d\\repeat-b\r\nexit=0\r\n  Determining projects to restore...\r\n  All projects are up-to-date for restore.\r\n  Depot -> C:\\Users\\pingu\\AppData\\Local\\Temp\\playbook-timestamps-8e1f6d7062914d09bc90f546c5cb644d\\bin\\Release\\net10.0\\Depot.dll\r\n  The package Depot.Manifest.1.0.0 is missing a readme. Go to https://aka.ms/nuget/authoring-best-practices/readme to learn why package readmes are important.\r\n  Successfully created package 'C:\\Users\\pingu\\AppData\\Local\\Temp\\playbook-timestamps-8e1f6d7062914d09bc90f546c5cb644d\\repeat-b\\Depot.Manifest.1.0.0.nupkg'.\r\n\r\nC:\\Users\\pingu\\AppData\\Local\\Temp\\playbook-timestamps-8e1f6d7062914d09bc90f546c5cb644d\\repeat-a\\Depot.Manifest.1.0.0.nupkg: 2000-01-01T00:00:00.0000000,2000-01-01T00:00:00.0000000,2000-01-01T00:00:00.0000000,2000-01-01T00:00:00.0000000,2000-01-01T00:00:00.0000000,2000-01-01T00:00:00.0000000; sha256=360D90517925C214EE8EF745DE25F0484A10B63281298700CE652DE15C051805\r\nC:\\Users\\pingu\\AppData\\Local\\Temp\\playbook-timestamps-8e1f6d7062914d09bc90f546c5cb644d\\repeat-b\\Depot.Manifest.1.0.0.nupkg: 2000-01-01T00:00:00.0000000,2000-01-01T00:00:00.0000000,2000-01-01T00:00:00.0000000,2000-01-01T00:00:00.0000000,2000-01-01T00:00:00.0000000,2000-01-01T00:00:00.0000000; sha256=360D90517925C214EE8EF745DE25F0484A10B63281298700CE652DE15C051805\r\nPASS older unsigned archive normalization; no full-byte reproducibility claim\r\nPASS package timestamps; runtime=10.0.13; fixture=C:\\Users\\pingu\\AppData\\Local\\Temp\\playbook-timestamps-8e1f6d7062914d09bc90f546c5cb644d"
}
