{
  "kind": "compile-and-run",
  "sample": "samples/net11.0/CrashEvidence/CrashEvidence.csproj",
  "target": "net11.0",
  "sdk": "11.0.100-rc.2.26504.105",
  "language": "15.0",
  "command": "eng/Test-CrashEvidence.ps1; image=mcr.microsoft.com/dotnet/sdk@sha256:bfabf51e74c5a7cf2fc4eac852145db86f4867d475257d809518d6a2b0fe71e1; /usr/share/dotnet/dotnet build CrashEvidence.csproj --configuration Release -p:RestoreLockedMode=true -p:NuGetAudit=false; /usr/share/dotnet/dotnet ./bin/Release/net11.0/CrashEvidence.dll",
  "scope": "Actual configured Linux x64 CoreCLR child crash in a disposable network-disabled container; original crash frame checked in the generated report. No Windows, Apple, mobile, NativeAOT, debugger or production-crash proof.",
  "recordedAt": "2026-10-22T20:16:21.2757792+00:00",
  "sourceCommit": "16672e535f6a3edf84a5ac2dd578e4cd1198ccd0",
  "sourceDirty": true,
  "inputs": {
    ".editorconfig": "c99359640a7ebc05cb7e8246fa002e9cd12b3b10bc7773f1af574391e8e94664",
    "eng/Evidence.ps1": "b3dbd6b3788e31aefe1533ef89fed66625f2a637993f9291e8d1d4fc8a2ba849",
    "eng/Record-Evidence.ps1": "653a32b1ebe5be60a5489afd9a7a963dbbabf5c2ecfd47fe480974fd5d939498",
    "eng/Test-CrashEvidence.ps1": "0cfe3892ed3a3b9b6ba9c21932f272d07c66bea9f0954db983cb0afea0466454",
    "NuGet.Config": "aec93b5637ab6d62470979a008990a4a336a287ab83a3f2541849ae735674055",
    "samples/Directory.Build.props": "ac524510d3e5112332f8c69b4c7b367c90642848dfd249163bd084405502def6",
    "samples/Directory.Build.targets": "17284cb74605517cbec8a8153505da71a685b28694b67b5ef80608cd79b1c0ea",
    "samples/Directory.Packages.props": "7209dd1e4245a84c619bada1f05c2505db0eb84ee6123af21759267b9c7e36a1",
    "samples/net11.0/CrashEvidence/Configuration.cs": "141cf491000386e71a739ea19a13966fa68a2124639385bffde9b3b41985a76b",
    "samples/net11.0/CrashEvidence/CrashEvidence.csproj": "6322a328806c42bfb50f905411515651f203b189d06f96493b869304c64a9883",
    "samples/net11.0/CrashEvidence/global.json": "d9fd82b26a07e3966f2c69312ae0467dc039acbdb6426d99fc9ae5c82db81214",
    "samples/net11.0/CrashEvidence/Program.cs": "13f20f519d9a3754b30e347865a7cac6d36d746041919aece7f0586f41c32db2",
    "samples/net11.0/CrashEvidence/verification.json": "dc01ad1c7b78f1b90f34020164065b72a529350d3b61c0a5a2150da794103569"
  },
  "dependencies": [],
  "workloads": [],
  "nativeToolchains": [],
  "host": "Ubuntu 26.04.1 LTS / X64",
  "sdkInfo": ".NET SDK:\n Version:           11.0.100-rc.2.26504.105\n Commit:            820230c386\n Workload version:  11.0.100-manifests.4d7a54d2\n MSBuild version:   18.12.0-1.26504.105+820230c38\n\nRuntime Environment:\n OS Name:     ubuntu\n OS Version:  26.04\n OS Platform: Linux\n RID:         linux-x64\n Base Path:   /usr/share/dotnet/sdk/11.0.100-rc.2.26504.105\n\n.NET workloads installed:\nThere are no installed workloads to display.\nConfigured to use workload sets when installing new manifests.\nNo workload sets are installed. Run \"dotnet workload restore\" to install a workload set.\n\nHost:\n  Version:      11.0.0-rc.2.26504.105\n  Architecture: x64\n  Commit:       820230c386\n\n.NET SDKs installed:\n  11.0.100-rc.2.26504.105 [/usr/share/dotnet/sdk]\n\n.NET runtimes installed:\n  Microsoft.AspNetCore.App 11.0.0-rc.2.26504.105 [/usr/share/dotnet/shared/Microsoft.AspNetCore.App]\n  Microsoft.NETCore.App 11.0.0-rc.2.26504.105 [/usr/share/dotnet/shared/Microsoft.NETCore.App]\n\nOther architectures found:\n  None\n\nEnvironment variables:\n  DOTNET_ADD_GLOBAL_TOOLS_TO_PATH          [0]\n  DOTNET_CLI_TELEMETRY_OPTOUT              [1]\n  DOTNET_GENERATE_ASPNET_CERTIFICATE       [false]\n  DOTNET_NOLOGO                            [true]\n  DOTNET_RUNNING_IN_CONTAINER              [true]\n  DOTNET_SDK_VERSION                       [11.0.100-rc.2.26504.105]\n  DOTNET_USE_POLLING_FILE_WATCHER          [true]\n  DOTNET_VERSION                           [11.0.0-rc.2.26504.105]\n\nglobal.json file:\n  /work/samples/net11.0/CrashEvidence/global.json\n\nLearn more:\n  https://aka.ms/dotnet/info\n\nDownload .NET:\n  https://aka.ms/dotnet/download",
  "workloadInfo": "Workload version: 11.0.100-manifests.4d7a54d2\n\nInstalled Workload Id      Manifest Version      Installation Source\n--------------------------------------------------------------------\n\nUse `dotnet workload search` to find additional workloads to install.",
  "output": "Determining projects to restore...\n  Restored /work/samples/net11.0/CrashEvidence/CrashEvidence.csproj (in 109 ms).\n/usr/share/dotnet/sdk/11.0.100-rc.2.26504.105/Sdks/Microsoft.NET.Sdk/targets/Microsoft.NET.RuntimeIdentifierInference.targets(385,5): message NETSDK1057: You are using a preview version of .NET. See: https://aka.ms/dotnet-support-policy [/work/samples/net11.0/CrashEvidence/CrashEvidence.csproj]\n  CrashEvidence -> /work/samples/net11.0/CrashEvidence/bin/Release/net11.0/CrashEvidence.dll\n\nBuild succeeded.\n    0 Warning(s)\n    0 Error(s)\n\nTime Elapsed 00:00:04.89\nIn-proc crash report watchdog received a finish notification; exiting watchdog thread.\nProcess terminated.\ndispatch-fixture-failure\n   at System.Environment.FailFast(System.Runtime.CompilerServices.StackCrawlMarkHandle, System.String, System.Runtime.CompilerServices.ObjectHandleOnStack, System.String)\n   at System.Environment.FailFast(System.Threading.StackCrawlMark ByRef, System.String, System.Exception, System.String)\n   at System.Environment.FailFast(System.String)\n   at Program.<<Main>$>g__DispatchFailure|0_0()\n   at Program+<<Main>$>d__0.MoveNext()\n   at System.Runtime.CompilerServices.AsyncMethodBuilderCore.Start[[Program+<<Main>$>d__0, CrashEvidence, Version=1.0.0.0, Culture=neutral, PublicKeyToken=null]](<<Main>$>d__0 ByRef)\n   at System.Runtime.CompilerServices.AsyncTaskMethodBuilder.Start[[Program+<<Main>$>d__0, CrashEvidence, Version=1.0.0.0, Culture=neutral, PublicKeyToken=null]](<<Main>$>d__0 ByRef)\n   at Program.<Main>$(System.String[])\n   at Program.<Main>(System.String[])\n*** *** *** *** *** *** *** *** *** *** *** *** *** *** *** ***\n.NET Crash Report v1.0.0\nBuild: 11.0.26.50505 @Commit: 820230c386db5b0106c5430b3e5aee92a7826bf5\nABI: amd64\nCmdline: dotnet\npid: 216\nsignal 6 (SIGABRT)\n\n--- thread 0xd8 (crashed) ---\n  #00 [0] System.Environment.FailFast + 0x14 (token=0x60004b0)\n  #01 [0] System.Environment.FailFast + 0x14 (token=0x60004af)\n  #02 [0] System.Environment.FailFast + 0xc (token=0x60004ac)\n  #03 [1] Program.<<Main>$>g__DispatchFailure|0_0 + 0xa (token=0x6000004)\n  #04 [1] <<Main>$>d__0.MoveNext + 0x35 (token=0x6000006)\n  #05 [0] System.Runtime.CompilerServices.AsyncMethodBuilderCore.Start + 0x28 (token=0x600806e)\n  #06 [0] System.Runtime.CompilerServices.AsyncTaskMethodBuilder.Start + 0x6 (token=0x6008080)\n  #07 [1] Program.<Main>$ + 0x2a (token=0x6000001)\n  #08 [1] Program.<Main> + 0x0 (token=0x6000003)\n  #09 [0] System.Environment.CallEntryPoint + 0x1c (token=0x60004b5)\n\n--- thread 0xde ---\n  (no managed frames)\n\n--- thread 0xe0 ---\n  (no managed frames)\n\nmodules:\n  [0] System.Private.CoreLib {b8f085fc-6029-4914-9919-615d87fdd090}\n  [1] CrashEvidence {2173959b-85c6-4074-a879-2c84dba6af32}\n*** *** *** *** *** *** *** *** *** *** *** *** *** *** *** ***\n\nREPORT: .dotnet/crash-reports/report-1792700180395283207-216.crashreport.json (4033 bytes)\nPASS: configured crash report contains DispatchFailure; child exit=134; .NET 11.0.0-rc.2.26504.105; Linux x64 actual crash, no mock."
}
