{
  "kind": "compile",
  "sample": "samples/net10.0/ParcelStartup/Client/Client.csproj",
  "target": "net10.0",
  "sdk": "10.0.402",
  "language": "14.0",
  "command": "C:\\Program Files\\dotnet\\dotnet.exe build Client.csproj --configuration Release -p:RestoreLockedMode=true",
  "scope": "See recipe scope; output records only the commands actually performed.",
  "recordedAt": "2026-10-23T05:48:45.0852725+00:00",
  "sourceCommit": "89e09cdefbbbca51eed0b0cc3f2fcd06fecc4c3d",
  "sourceDirty": true,
  "inputs": {
    ".editorconfig": "c99359640a7ebc05cb7e8246fa002e9cd12b3b10bc7773f1af574391e8e94664",
    "eng/Evidence.ps1": "b3dbd6b3788e31aefe1533ef89fed66625f2a637993f9291e8d1d4fc8a2ba849",
    "eng/ParcelStartup.browser.js": "dd9b4592d9046ab9316a45fdc3a43d6c26de7e4592c7facd8d0227910e0b2c53",
    "eng/Record-Evidence.ps1": "653a32b1ebe5be60a5489afd9a7a963dbbabf5c2ecfd47fe480974fd5d939498",
    "NuGet.Config": "aec93b5637ab6d62470979a008990a4a336a287ab83a3f2541849ae735674055",
    "samples/Directory.Build.props": "ac524510d3e5112332f8c69b4c7b367c90642848dfd249163bd084405502def6",
    "samples/Directory.Build.targets": "17284cb74605517cbec8a8153505da71a685b28694b67b5ef80608cd79b1c0ea",
    "samples/net10.0/ParcelStartup/Client/_Imports.razor": "cb575fd16905c2eb1784de2dfd0e9f9035b4de0654209b436d205306f2d87db2",
    "samples/net10.0/ParcelStartup/Client/Client.csproj": "65b3c06f837f39b1c7392550b906c968aee1b2552890b198a92f15486150c953",
    "samples/net10.0/ParcelStartup/Client/Directory.Packages.props": "750ee5e9b26c8b0dd1b8e5863423ccec335250d8aab6bc1ca525ee8b2080316f",
    "samples/net10.0/ParcelStartup/Client/global.json": "d1bb820bf074027be921b263729d1fba343d34328f0c4b7484d10162287c059e",
    "samples/net10.0/ParcelStartup/Client/packages.lock.json": "8e484237525ca98bf78eae352171b68932db654f256d709ba34bbbb1ff67791c",
    "samples/net10.0/ParcelStartup/Client/ParcelCounter.razor": "d6384ec931a672265f591707b27c0cbc48b08b5fa1f2a9659b38916643d7c673",
    "samples/net10.0/ParcelStartup/Client/Program.cs": "ed7459d9b5e4c5719438cb06ec3717852de7baac6f0779fe696712e3d82e6f34",
    "samples/net10.0/ParcelStartup/Client/verification.json": "831849d6ea013c80e250a7811afc9c9d331999738e0e6e9bb37443fc68547a2d"
  },
  "dependencies": [
    "Microsoft.AspNetCore.App.Internal.Assets/10.0.13",
    "Microsoft.AspNetCore.Authorization/10.0.13",
    "Microsoft.AspNetCore.Components.Analyzers/10.0.13",
    "Microsoft.AspNetCore.Components.Forms/10.0.13",
    "Microsoft.AspNetCore.Components.Web/10.0.13",
    "Microsoft.AspNetCore.Components.WebAssembly/10.0.13",
    "Microsoft.AspNetCore.Components/10.0.13",
    "Microsoft.AspNetCore.Metadata/10.0.13",
    "Microsoft.Extensions.Configuration.Abstractions/10.0.13",
    "Microsoft.Extensions.Configuration.Binder/10.0.13",
    "Microsoft.Extensions.Configuration.FileExtensions/10.0.13",
    "Microsoft.Extensions.Configuration.Json/10.0.13",
    "Microsoft.Extensions.Configuration/10.0.13",
    "Microsoft.Extensions.DependencyInjection.Abstractions/10.0.13",
    "Microsoft.Extensions.DependencyInjection/10.0.13",
    "Microsoft.Extensions.Diagnostics.Abstractions/10.0.13",
    "Microsoft.Extensions.Diagnostics/10.0.13",
    "Microsoft.Extensions.FileProviders.Abstractions/10.0.13",
    "Microsoft.Extensions.FileProviders.Physical/10.0.13",
    "Microsoft.Extensions.FileSystemGlobbing/10.0.13",
    "Microsoft.Extensions.Logging.Abstractions/10.0.13",
    "Microsoft.Extensions.Logging/10.0.13",
    "Microsoft.Extensions.Options.ConfigurationExtensions/10.0.13",
    "Microsoft.Extensions.Options/10.0.13",
    "Microsoft.Extensions.Primitives/10.0.13",
    "Microsoft.Extensions.Validation/10.0.13",
    "Microsoft.JSInterop.WebAssembly/10.0.13",
    "Microsoft.JSInterop/10.0.13",
    "Microsoft.NET.ILLink.Tasks/10.0.13",
    "Microsoft.NET.Sdk.WebAssembly.Pack/10.0.13"
  ],
  "workloads": [],
  "nativeToolchains": [],
  "host": "Microsoft Windows 10.0.26200 / X64",
  "sdkInfo": ".NET SDK:\r\n Version:           10.0.402\r\n Commit:            a8dd0577c5\r\n Workload version:  10.0.400-manifests.6055ec36\r\n MSBuild version:   18.9.15+a8dd0577c\r\n\r\nRuntime Environment:\r\n OS Name:     Windows\r\n OS Version:  10.0.26200\r\n OS Platform: Windows\r\n RID:         win-x64\r\n Base Path:   C:\\Program Files\\dotnet\\sdk\\10.0.402\\\r\n\r\n.NET workloads installed:\r\n [wasm-tools]\r\n   Installation Source: VS 18.11.12306.390\r\n   Manifest Version:    10.0.113/10.0.100\r\n   Manifest Path:       C:\\Program Files\\dotnet\\sdk-manifests\\10.0.100\\microsoft.net.workload.mono.toolchain.current\\10.0.113\\WorkloadManifest.json\r\n   Install Type:              Msi\r\n\r\n [maui-windows]\r\n   Installation Source: VS 18.11.12306.390\r\n   Manifest Version:    10.0.110/10.0.100\r\n   Manifest Path:       C:\\Program Files\\dotnet\\sdk-manifests\\10.0.100\\microsoft.net.sdk.maui\\10.0.110\\WorkloadManifest.json\r\n   Install Type:              Msi\r\n\r\n [maccatalyst]\r\n   Installation Source: VS 18.11.12306.390\r\n   Manifest Version:    26.5.10315/10.0.100\r\n   Manifest Path:       C:\\Program Files\\dotnet\\sdk-manifests\\10.0.100\\microsoft.net.sdk.maccatalyst\\26.5.10315\\WorkloadManifest.json\r\n   Install Type:              Msi\r\n\r\n [ios]\r\n   Installation Source: VS 18.11.12306.390\r\n   Manifest Version:    26.5.10315/10.0.100\r\n   Manifest Path:       C:\\Program Files\\dotnet\\sdk-manifests\\10.0.100\\microsoft.net.sdk.ios\\26.5.10315\\WorkloadManifest.json\r\n   Install Type:              Msi\r\n\r\n [android]\r\n   Installation Source: VS 18.11.12306.390\r\n   Manifest Version:    36.1.118/10.0.100\r\n   Manifest Path:       C:\\Program Files\\dotnet\\sdk-manifests\\10.0.100\\microsoft.net.sdk.android\\36.1.118\\WorkloadManifest.json\r\n   Install Type:              Msi\r\n\r\nConfigured to use workload sets when installing new manifests.\r\nNo workload sets are installed. Run \"dotnet workload restore\" to install a workload set.\r\n\r\nHost:\r\n  Version:      10.0.13\r\n  Architecture: x64\r\n  Commit:       4099f83977\r\n\r\n.NET SDKs installed:\r\n  10.0.300 [C:\\Program Files\\dotnet\\sdk]\r\n  10.0.402 [C:\\Program Files\\dotnet\\sdk]\r\n\r\n.NET runtimes installed:\r\n  Microsoft.AspNetCore.App 10.0.8 [C:\\Program Files\\dotnet\\shared\\Microsoft.AspNetCore.App]\r\n  Microsoft.AspNetCore.App 10.0.13 [C:\\Program Files\\dotnet\\shared\\Microsoft.AspNetCore.App]\r\n  Microsoft.NETCore.App 10.0.8 [C:\\Program Files\\dotnet\\shared\\Microsoft.NETCore.App]\r\n  Microsoft.NETCore.App 10.0.13 [C:\\Program Files\\dotnet\\shared\\Microsoft.NETCore.App]\r\n  Microsoft.WindowsDesktop.App 10.0.8 [C:\\Program Files\\dotnet\\shared\\Microsoft.WindowsDesktop.App]\r\n  Microsoft.WindowsDesktop.App 10.0.13 [C:\\Program Files\\dotnet\\shared\\Microsoft.WindowsDesktop.App]\r\n\r\nOther architectures found:\r\n  x86   [C:\\Program Files (x86)\\dotnet]\r\n    registered at [HKLM\\SOFTWARE\\dotnet\\Setup\\InstalledVersions\\x86\\InstallLocation]\r\n\r\nEnvironment variables:\r\n  DOTNET_ADD_GLOBAL_TOOLS_TO_PATH          [0]\r\n\r\nglobal.json file:\r\n  V:\\_worktrees\\Playbook\\agent-pin-789-04-017-unified-blazor-startup-script-options\\samples\\net10.0\\ParcelStartup\\Client\\global.json\r\n\r\nLearn more:\r\n  https://aka.ms/dotnet/info\r\n\r\nDownload .NET:\r\n  https://aka.ms/dotnet/download",
  "workloadInfo": "Workload version: 10.0.400-manifests.6055ec36\r\n\r\nInstalled Workload Id      Manifest Version         Installation Source\r\n-----------------------------------------------------------------------\r\nandroid                    36.1.118/10.0.100        VS 18.11.12306.390 \r\nios                        26.5.10315/10.0.100      VS 18.11.12306.390 \r\nmaccatalyst                26.5.10315/10.0.100      VS 18.11.12306.390 \r\nmaui-windows               10.0.110/10.0.100        VS 18.11.12306.390 \r\nwasm-tools                 10.0.113/10.0.100        VS 18.11.12306.390 \r\n\r\nUse `dotnet workload search` to find additional workloads to install.",
  "output": "Determining projects to restore...\r\n  All projects are up-to-date for restore.\r\n  Client -> V:\\_worktrees\\Playbook\\agent-pin-789-04-017-unified-blazor-startup-script-options\\samples\\net10.0\\ParcelStartup\\Client\\bin\\Release\\net10.0\\Client.dll\r\n  Client (Blazor output) -> V:\\_worktrees\\Playbook\\agent-pin-789-04-017-unified-blazor-startup-script-options\\samples\\net10.0\\ParcelStartup\\Client\\bin\\Release\\net10.0\\wwwroot\r\n\r\nBuild succeeded.\r\n    0 Warning(s)\r\n    0 Error(s)\r\n\r\nTime Elapsed 00:00:03.18"
}
