{
  "kind": "compile-and-run",
  "sample": "samples/net10.0/ReadonlyMetadata/ReadonlyMetadata.csproj",
  "target": "net10.0",
  "sdk": "10.0.402",
  "language": "14.0",
  "command": "C:\\Program Files\\dotnet\\dotnet.exe build ReadonlyMetadata.csproj --configuration Release -p:RestoreLockedMode=true; C:\\Program Files\\dotnet\\dotnet.exe V:\\_worktrees\\Playbook\\t3-6b360ce7\\samples\\net10.0\\ReadonlyMetadata\\bin\\Release\\net10.0\\ReadonlyMetadata.dll",
  "scope": "See recipe scope; output records only the commands actually performed.",
  "recordedAt": "2026-10-30T16:54:26.1503740+00:00",
  "sourceCommit": "4ef6f23509802a56ee29fe136931f47ff8d41c04",
  "sourceDirty": true,
  "inputs": {
    "eng/Evidence.ps1": "b3dbd6b3788e31aefe1533ef89fed66625f2a637993f9291e8d1d4fc8a2ba849",
    "eng/Record-Evidence.ps1": "653a32b1ebe5be60a5489afd9a7a963dbbabf5c2ecfd47fe480974fd5d939498",
    "eng/Test-CompilerMigrations.ps1": "3f040a82a7e74f769312a5a8f0cd80346d219b739d6aae8949a8f930a2cd3ca0",
    "NuGet.Config": "aec93b5637ab6d62470979a008990a4a336a287ab83a3f2541849ae735674055",
    "samples/CompilerMigrations/ReadonlyMetadata.cs": "44170be73af172453c113beeb59023bdb13d6a14848c24a943ed41253347aa5e",
    "samples/Directory.Build.props": "ac524510d3e5112332f8c69b4c7b367c90642848dfd249163bd084405502def6",
    "samples/Directory.Build.targets": "17284cb74605517cbec8a8153505da71a685b28694b67b5ef80608cd79b1c0ea",
    "samples/Directory.Packages.props": "7209dd1e4245a84c619bada1f05c2505db0eb84ee6123af21759267b9c7e36a1",
    "samples/net10.0/ReadonlyMetadata/global.json": "30fdf1d1d5cfadd6447ab39d18cc5eec405cf1a5ec5b2e4b1d228a6fe757846d",
    "samples/net10.0/ReadonlyMetadata/ReadonlyMetadata.csproj": "42a15fd706c95254f3c7eecaf315214ed2b9ff9d5ad24608abd3fbc962f58365",
    "samples/net10.0/ReadonlyMetadata/verification.json": "f131bf17c18ab63d03f010ce6cb746e852a0fd2d860f5a5cc518abbb6fef3e54",
    "samples/net11.0/DynamicConditions/DynamicConditions.cs": "bcce575b3bd3a6c13465881f040c4590ba4263b2dc8197ad1c83e125fc07b1df",
    "samples/net11.0/DynamicConditions/DynamicConditions.csproj": "55612853f8b7b90129f922214cde02abde65773df9e38cbd297c866042b40748",
    "samples/net11.0/DynamicConditions/global.json": "99e21c134d643fe49fe2df0d5c3b961f91c7ffe806ab12033266c7203b457116",
    "samples/net11.0/DynamicConditions/verification.json": "f131bf17c18ab63d03f010ce6cb746e852a0fd2d860f5a5cc518abbb6fef3e54",
    "samples/net11.0/SpanStorage/global.json": "99e21c134d643fe49fe2df0d5c3b961f91c7ffe806ab12033266c7203b457116",
    "samples/net11.0/SpanStorage/SpanEscape.cs": "120bff7bd1469c16ff5654fabd1b4de0753fa605f8e2683219992dd1c31a7fa8",
    "samples/net11.0/SpanStorage/SpanStorage.cs": "4d27225322cc7ff85d212c7b3384f66bc6455db57d76ec9a1482bdf3c1787c4c",
    "samples/net11.0/SpanStorage/SpanStorage.csproj": "0a6ef1ea74860d72acb597420baf9773e30996626f7c5ba1530e8cb4a0997c2e",
    "samples/net11.0/SpanStorage/verification.json": "f131bf17c18ab63d03f010ce6cb746e852a0fd2d860f5a5cc518abbb6fef3e54"
  },
  "dependencies": [],
  "workloads": [],
  "nativeToolchains": [],
  "host": "Microsoft Windows 10.0.26200 / X64",
  "sdkInfo": ".NET SDK:\r\n Version:           10.0.402\r\n Commit:            a8dd0577c5\r\n Workload version:  10.0.400-manifests.6055ec36\r\n MSBuild version:   18.9.15+a8dd0577c\r\n\r\nRuntime Environment:\r\n OS Name:     Windows\r\n OS Version:  10.0.26200\r\n OS Platform: Windows\r\n RID:         win-x64\r\n Base Path:   C:\\Program Files\\dotnet\\sdk\\10.0.402\\\r\n\r\n.NET workloads installed:\r\n [wasm-tools]\r\n   Installation Source: VS 18.11.12306.390\r\n   Manifest Version:    10.0.113/10.0.100\r\n   Manifest Path:       C:\\Program Files\\dotnet\\sdk-manifests\\10.0.100\\microsoft.net.workload.mono.toolchain.current\\10.0.113\\WorkloadManifest.json\r\n   Install Type:              Msi\r\n\r\n [maui-windows]\r\n   Installation Source: VS 18.11.12306.390\r\n   Manifest Version:    10.0.110/10.0.100\r\n   Manifest Path:       C:\\Program Files\\dotnet\\sdk-manifests\\10.0.100\\microsoft.net.sdk.maui\\10.0.110\\WorkloadManifest.json\r\n   Install Type:              Msi\r\n\r\n [maccatalyst]\r\n   Installation Source: VS 18.11.12306.390\r\n   Manifest Version:    26.5.10315/10.0.100\r\n   Manifest Path:       C:\\Program Files\\dotnet\\sdk-manifests\\10.0.100\\microsoft.net.sdk.maccatalyst\\26.5.10315\\WorkloadManifest.json\r\n   Install Type:              Msi\r\n\r\n [ios]\r\n   Installation Source: VS 18.11.12306.390\r\n   Manifest Version:    26.5.10315/10.0.100\r\n   Manifest Path:       C:\\Program Files\\dotnet\\sdk-manifests\\10.0.100\\microsoft.net.sdk.ios\\26.5.10315\\WorkloadManifest.json\r\n   Install Type:              Msi\r\n\r\n [android]\r\n   Installation Source: VS 18.11.12306.390\r\n   Manifest Version:    36.1.118/10.0.100\r\n   Manifest Path:       C:\\Program Files\\dotnet\\sdk-manifests\\10.0.100\\microsoft.net.sdk.android\\36.1.118\\WorkloadManifest.json\r\n   Install Type:              Msi\r\n\r\nConfigured to use workload sets when installing new manifests.\r\nNo workload sets are installed. Run \"dotnet workload restore\" to install a workload set.\r\n\r\nHost:\r\n  Version:      10.0.13\r\n  Architecture: x64\r\n  Commit:       4099f83977\r\n\r\n.NET SDKs installed:\r\n  10.0.300 [C:\\Program Files\\dotnet\\sdk]\r\n  10.0.402 [C:\\Program Files\\dotnet\\sdk]\r\n\r\n.NET runtimes installed:\r\n  Microsoft.AspNetCore.App 10.0.8 [C:\\Program Files\\dotnet\\shared\\Microsoft.AspNetCore.App]\r\n  Microsoft.AspNetCore.App 10.0.13 [C:\\Program Files\\dotnet\\shared\\Microsoft.AspNetCore.App]\r\n  Microsoft.NETCore.App 10.0.8 [C:\\Program Files\\dotnet\\shared\\Microsoft.NETCore.App]\r\n  Microsoft.NETCore.App 10.0.13 [C:\\Program Files\\dotnet\\shared\\Microsoft.NETCore.App]\r\n  Microsoft.WindowsDesktop.App 10.0.8 [C:\\Program Files\\dotnet\\shared\\Microsoft.WindowsDesktop.App]\r\n  Microsoft.WindowsDesktop.App 10.0.13 [C:\\Program Files\\dotnet\\shared\\Microsoft.WindowsDesktop.App]\r\n\r\nOther architectures found:\r\n  x86   [C:\\Program Files (x86)\\dotnet]\r\n    registered at [HKLM\\SOFTWARE\\dotnet\\Setup\\InstalledVersions\\x86\\InstallLocation]\r\n\r\nEnvironment variables:\r\n  DOTNET_ADD_GLOBAL_TOOLS_TO_PATH          [0]\r\n  DOTNET_GENERATE_ASPNET_CERTIFICATE       [false]\r\n  DOTNET_ROOT                              [C:\\Users\\pingu\\AppData\\Local\\dotnetup\\dotnet]\r\n\r\nglobal.json file:\r\n  V:\\_worktrees\\Playbook\\t3-6b360ce7\\samples\\net10.0\\ReadonlyMetadata\\global.json\r\n\r\nLearn more:\r\n  https://aka.ms/dotnet/info\r\n\r\nDownload .NET:\r\n  https://aka.ms/dotnet/download",
  "workloadInfo": "Workload version: 10.0.400-manifests.6055ec36\r\n\r\nInstalled Workload Id      Manifest Version         Installation Source\r\n-----------------------------------------------------------------------\r\nandroid                    36.1.118/10.0.100        VS 18.11.12306.390 \r\nios                        26.5.10315/10.0.100      VS 18.11.12306.390 \r\nmaccatalyst                26.5.10315/10.0.100      VS 18.11.12306.390 \r\nmaui-windows               10.0.110/10.0.100        VS 18.11.12306.390 \r\nwasm-tools                 10.0.113/10.0.100        VS 18.11.12306.390 \r\n\r\nUse `dotnet workload search` to find additional workloads to install.",
  "output": "Determining projects to restore...\r\n  All projects are up-to-date for restore.\r\n  ReadonlyMetadata -> V:\\_worktrees\\Playbook\\t3-6b360ce7\\samples\\net10.0\\ReadonlyMetadata\\bin\\Release\\net10.0\\ReadonlyMetadata.dll\r\n\r\nBuild succeeded.\r\n    0 Warning(s)\r\n    0 Error(s)\r\n\r\nTime Elapsed 00:00:01.76\nPASS metadata Invoke: byref modreq(System.Runtime.InteropServices.InAttribute)\r\nPASS metadata Invoke: byref modreq(System.Runtime.InteropServices.InAttribute)\r\nPASS metadata <Verify>g__LocalRead|3_1: byref modreq(System.Runtime.InteropServices.InAttribute)\r\nPASS readonly: method-group/lambda/local calls retain 42 -> 73 reference identity"
}
