{
  "kind": "compile-and-run",
  "sample": "samples/net9.0/MossRequests/MossRequests.csproj",
  "target": "net9.0",
  "sdk": "9.0.319",
  "language": "13.0",
  "command": "C:\\Users\\pingu\\.dotnet-playbook-9\\dotnet.exe build MossRequests.csproj --configuration Release -p:RestoreLockedMode=true; C:\\Users\\pingu\\.dotnet-playbook-9\\dotnet.exe V:\\_worktrees\\Playbook\\t3-ee5bbcd5\\samples\\net9.0\\MossRequests\\bin\\Release\\net9.0\\MossRequests.dll",
  "scope": "See recipe scope; output records only the commands actually performed.",
  "recordedAt": "2026-10-28T16:32:13.6358313+00:00",
  "sourceCommit": "2130b06141542bb009224ebc200c463e60e9a680",
  "sourceDirty": true,
  "inputs": {
    ".editorconfig": "c99359640a7ebc05cb7e8246fa002e9cd12b3b10bc7773f1af574391e8e94664",
    "eng/Evidence.ps1": "b3dbd6b3788e31aefe1533ef89fed66625f2a637993f9291e8d1d4fc8a2ba849",
    "eng/Record-Evidence.ps1": "653a32b1ebe5be60a5489afd9a7a963dbbabf5c2ecfd47fe480974fd5d939498",
    "NuGet.Config": "aec93b5637ab6d62470979a008990a4a336a287ab83a3f2541849ae735674055",
    "samples/net10.0/MossRequests/MossRequestChecks.cs": "39504fdec87c0c63ec8afd16ef95935237786fa844e80b4e41aa683913129cde",
    "samples/net9.0/MossRequests/Directory.Build.props": "347e2e29465c6a37869dd07b0b401c55743b8571fb513a4e42b6ee8facc06ca4",
    "samples/net9.0/MossRequests/Directory.Build.targets": "347e2e29465c6a37869dd07b0b401c55743b8571fb513a4e42b6ee8facc06ca4",
    "samples/net9.0/MossRequests/Directory.Packages.props": "8ab8b3576f7e9410226e0f440f4cbfd47e46cf50d5c56102fd0e5966374c10e5",
    "samples/net9.0/MossRequests/global.json": "110a8cb8c44f411a9b7e3db1f692dd34784a31f12861515b337fbff9c7e10473",
    "samples/net9.0/MossRequests/MossRequests.csproj": "eb9652e33dab505b3e2310fcc1a0dacb93ac0183e859891a4ee17882ad34bdf4",
    "samples/net9.0/MossRequests/Program.cs": "9c007e4a72e73712c9846c9f4e0d8ad678d0d52c2199e7cf78aa56c7cf5b6c82",
    "samples/net9.0/MossRequests/verification.json": "0d4f1066902f7c65d9488610619f0ed0480903fda37b7b13a0266ab6bcc72dc6",
    "samples/net9.0/MossRequests/WatchRequest.cs": "6595bba482c6abff371c90259b86681fc227e9d39c5f79a256a91640a9272cf4"
  },
  "dependencies": [],
  "workloads": [],
  "nativeToolchains": [],
  "host": "Microsoft Windows 10.0.26200 / X64",
  "sdkInfo": ".NET SDK:\r\n Version:           9.0.319\r\n Commit:            9de5af5aa0\r\n Workload version:  9.0.300-manifests.f33e7c40\r\n MSBuild version:   17.14.60+43b635718\r\n\r\nRuntime Environment:\r\n OS Name:     Windows\r\n OS Version:  10.0.26200\r\n OS Platform: Windows\r\n RID:         win-x64\r\n Base Path:   C:\\Users\\pingu\\.dotnet-playbook-9\\sdk\\9.0.319\\\r\n\r\n.NET workloads installed:\r\nThere are no installed workloads to display.\r\nConfigured to use loose manifests when installing new manifests.\r\n\r\nHost:\r\n  Version:      9.0.21\r\n  Architecture: x64\r\n  Commit:       d280e4fb38\r\n\r\n.NET SDKs installed:\r\n  9.0.319 [C:\\Users\\pingu\\.dotnet-playbook-9\\sdk]\r\n\r\n.NET runtimes installed:\r\n  Microsoft.AspNetCore.App 9.0.21 [C:\\Users\\pingu\\.dotnet-playbook-9\\shared\\Microsoft.AspNetCore.App]\r\n  Microsoft.NETCore.App 9.0.21 [C:\\Users\\pingu\\.dotnet-playbook-9\\shared\\Microsoft.NETCore.App]\r\n  Microsoft.WindowsDesktop.App 9.0.21 [C:\\Users\\pingu\\.dotnet-playbook-9\\shared\\Microsoft.WindowsDesktop.App]\r\n\r\nOther architectures found:\r\n  x86   [C:\\Program Files (x86)\\dotnet]\r\n    registered at [HKLM\\SOFTWARE\\dotnet\\Setup\\InstalledVersions\\x86\\InstallLocation]\r\n\r\nEnvironment variables:\r\n  DOTNET_ROOT       [C:\\Users\\pingu\\AppData\\Local\\dotnetup\\dotnet]\r\n\r\nglobal.json file:\r\n  V:\\_worktrees\\Playbook\\t3-ee5bbcd5\\samples\\net9.0\\MossRequests\\global.json\r\n\r\nLearn more:\r\n  https://aka.ms/dotnet/info\r\n\r\nDownload .NET:\r\n  https://aka.ms/dotnet/download",
  "workloadInfo": "Installed Workload Id      Manifest Version      Installation Source\r\n--------------------------------------------------------------------\r\n\r\nUse `dotnet workload search` to find additional workloads to install.",
  "output": "Determining projects to restore...\r\n  All projects are up-to-date for restore.\r\n  MossRequests -> V:\\_worktrees\\Playbook\\t3-ee5bbcd5\\samples\\net9.0\\MossRequests\\bin\\Release\\net9.0\\MossRequests.dll\r\n\r\nBuild succeeded.\r\n    0 Warning(s)\r\n    0 Error(s)\r\n\r\nTime Elapsed 00:00:01.99\nPASS .NET 9.0.21: 4 real HTTP requests; invalid fields and malformed JSON return 400 with zero handler calls; valid request executes once; business conflict is separate. No mocks or async validation."
}
