{
  "kind": "compile-and-run",
  "sample": "samples/net11.0/ExtensionProperties/ExtensionProperties.csproj",
  "target": "net11.0",
  "sdk": "11.0.100-rc.2.26504.105",
  "language": "14.0",
  "command": "C:\\Users\\pingu\\.dotnet-playbook-11\\dotnet.exe build ExtensionProperties.csproj --configuration Release -p:RestoreLockedMode=true; C:\\Users\\pingu\\.dotnet-playbook-11\\dotnet.exe V:\\_worktrees\\Playbook\\t3-16ef26d1\\samples\\net11.0\\ExtensionProperties\\bin\\Release\\net11.0\\ExtensionProperties.dll",
  "scope": "See recipe scope; output records only the commands actually performed.",
  "recordedAt": "2026-10-21T11:16:09.5824925+00:00",
  "sourceCommit": "599fae9cd6bb5548fb64e712b4c3ec45d3ec7972",
  "sourceDirty": true,
  "inputs": {
    "eng/Evidence.ps1": "ef7014f626c7cae314d7054331799671c79d9226c1a3eeaed0f912225eb172a2",
    "eng/Record-Evidence.ps1": "653a32b1ebe5be60a5489afd9a7a963dbbabf5c2ecfd47fe480974fd5d939498",
    "NuGet.Config": "aec93b5637ab6d62470979a008990a4a336a287ab83a3f2541849ae735674055",
    "samples/Directory.Build.props": "ac524510d3e5112332f8c69b4c7b367c90642848dfd249163bd084405502def6",
    "samples/Directory.Build.targets": "17284cb74605517cbec8a8153505da71a685b28694b67b5ef80608cd79b1c0ea",
    "samples/Directory.Packages.props": "7209dd1e4245a84c619bada1f05c2505db0eb84ee6123af21759267b9c7e36a1",
    "samples/ExtensionPropertyChecks.cs": "bf9a8e60c7b9107b8f5d28f6c7e25f0cd6c117222eb287fae398817f65ef8fb1",
    "samples/net11.0/ExtensionProperties/ExtensionProperties.csproj": "b457fd1a679adac079131d12b585aa90b6038874c253630cedb4348e0686ab9a",
    "samples/net11.0/ExtensionProperties/global.json": "99e21c134d643fe49fe2df0d5c3b961f91c7ffe806ab12033266c7203b457116",
    "samples/net11.0/ExtensionProperties/ShelfExtensions.cs": "4116ac8ec315abedd944ade5d34d761676ecf1dc539c5b3277ef6dbe5dd7d397",
    "samples/net11.0/ExtensionProperties/verification.json": "d783efbce849b675ed60dee1e913ea99d86bc149124678aa4e6319c6b416c3a8"
  },
  "dependencies": [],
  "workloads": [],
  "nativeToolchains": [],
  "host": "Microsoft Windows 10.0.26200 / X64",
  "sdkInfo": ".NET SDK:\r\n Version:           11.0.100-rc.2.26504.105\r\n Commit:            820230c386\r\n Workload version:  11.0.100-manifests.4d7a54d2\r\n MSBuild version:   18.12.0-1.26504.105+820230c38\r\n\r\nRuntime Environment:\r\n OS Name:     Windows\r\n OS Version:  10.0.26200\r\n OS Platform: Windows\r\n RID:         win-x64\r\n Base Path:   C:\\Users\\pingu\\.dotnet-playbook-11\\sdk\\11.0.100-rc.2.26504.105\r\n\r\n.NET workloads installed:\r\n [wasm-tools]\r\n   Installation Source: VS 18.11.12306.390\r\n   Manifest Version:    11.0.100-rc.2.26504.105/11.0.100-rc.2\r\n   Manifest Path:       C:\\Users\\pingu\\.dotnet-playbook-11\\sdk-manifests\\11.0.100-rc.2\\microsoft.net.workload.mono.toolchain.current\\11.0.100-rc.2.26504.105\\WorkloadManifest.json\r\n   Install Type:        FileBased\r\n\r\n [maui-windows]\r\n   Installation Source: VS 18.11.12306.390\r\n   Manifest Version:    11.0.0-preview.6.26360.8/11.0.100-preview.6\r\n   Manifest Path:       C:\\Users\\pingu\\.dotnet-playbook-11\\sdk-manifests\\11.0.100-preview.6\\microsoft.net.sdk.maui\\11.0.0-preview.6.26360.8\\WorkloadManifest.json\r\n   Install Type:        FileBased\r\n\r\n [maccatalyst]\r\n   Installation Source: VS 18.11.12306.390\r\n   Manifest Version:    26.5.11720-net11-p6/11.0.100-preview.6\r\n   Manifest Path:       C:\\Users\\pingu\\.dotnet-playbook-11\\sdk-manifests\\11.0.100-preview.6\\microsoft.net.sdk.maccatalyst\\26.5.11720-net11-p6\\WorkloadManifest.json\r\n   Install Type:        FileBased\r\n\r\n [ios]\r\n   Installation Source: VS 18.11.12306.390\r\n   Manifest Version:    26.5.11720-net11-p6/11.0.100-preview.6\r\n   Manifest Path:       C:\\Users\\pingu\\.dotnet-playbook-11\\sdk-manifests\\11.0.100-preview.6\\microsoft.net.sdk.ios\\26.5.11720-net11-p6\\WorkloadManifest.json\r\n   Install Type:        FileBased\r\n\r\n [android]\r\n   Installation Source: VS 18.11.12306.390\r\n   Manifest Version:    37.0.0-preview.6.59/11.0.100-preview.6\r\n   Manifest Path:       C:\\Users\\pingu\\.dotnet-playbook-11\\sdk-manifests\\11.0.100-preview.6\\microsoft.net.sdk.android\\37.0.0-preview.6.59\\WorkloadManifest.json\r\n   Install Type:        FileBased\r\n\r\nConfigured to use workload sets when installing new manifests.\r\nNo workload sets are installed. Run \"dotnet workload restore\" to install a workload set.\r\n\r\nHost:\r\n  Version:      11.0.0-rc.2.26504.105\r\n  Architecture: x64\r\n  Commit:       820230c386\r\n\r\n.NET SDKs installed:\r\n  11.0.100-rc.2.26504.105 [C:\\Users\\pingu\\.dotnet-playbook-11\\sdk]\r\n\r\n.NET runtimes installed:\r\n  Microsoft.AspNetCore.App 11.0.0-rc.2.26504.105 [C:\\Users\\pingu\\.dotnet-playbook-11\\shared\\Microsoft.AspNetCore.App]\r\n  Microsoft.NETCore.App 11.0.0-rc.2.26504.105 [C:\\Users\\pingu\\.dotnet-playbook-11\\shared\\Microsoft.NETCore.App]\r\n  Microsoft.WindowsDesktop.App 11.0.0-rc.2.26504.105 [C:\\Users\\pingu\\.dotnet-playbook-11\\shared\\Microsoft.WindowsDesktop.App]\r\n\r\nOther architectures found:\r\n  x86   [C:\\Program Files (x86)\\dotnet]\r\n    registered at [HKLM\\SOFTWARE\\dotnet\\Setup\\InstalledVersions\\x86\\InstallLocation]\r\n\r\nEnvironment variables:\r\n  DOTNET_ADD_GLOBAL_TOOLS_TO_PATH          [0]\r\n\r\nglobal.json file:\r\n  V:\\_worktrees\\Playbook\\t3-16ef26d1\\samples\\net11.0\\ExtensionProperties\\global.json\r\n\r\nLearn more:\r\n  https://aka.ms/dotnet/info\r\n\r\nDownload .NET:\r\n  https://aka.ms/dotnet/download",
  "workloadInfo": "Workload version: 11.0.100-manifests.4d7a54d2\r\n\r\nInstalled Workload Id      Manifest Version                                 Installation Source\r\n-----------------------------------------------------------------------------------------------\r\nandroid                    37.0.0-preview.6.59/11.0.100-preview.6           VS 18.11.12306.390 \r\nios                        26.5.11720-net11-p6/11.0.100-preview.6           VS 18.11.12306.390 \r\nmaccatalyst                26.5.11720-net11-p6/11.0.100-preview.6           VS 18.11.12306.390 \r\nmaui-windows               11.0.0-preview.6.26360.8/11.0.100-preview.6      VS 18.11.12306.390 \r\nwasm-tools                 11.0.100-rc.2.26504.105/11.0.100-rc.2            VS 18.11.12306.390 \r\n\r\nUse `dotnet workload search` to find additional workloads to install.",
  "output": "Determining projects to restore...\r\n  Restored V:\\_worktrees\\Playbook\\t3-16ef26d1\\samples\\net11.0\\ExtensionProperties\\ExtensionProperties.csproj (in 0.8 ms).\r\nC:\\Users\\pingu\\.dotnet-playbook-11\\sdk\\11.0.100-rc.2.26504.105\\Sdks\\Microsoft.NET.Sdk\\targets\\Microsoft.NET.RuntimeIdentifierInference.targets(385,5): message NETSDK1057: You are using a preview version of .NET. See: https://aka.ms/dotnet-support-policy [V:\\_worktrees\\Playbook\\t3-16ef26d1\\samples\\net11.0\\ExtensionProperties\\ExtensionProperties.csproj]\r\n  ExtensionProperties -> V:\\_worktrees\\Playbook\\t3-16ef26d1\\samples\\net11.0\\ExtensionProperties\\bin\\Release\\net11.0\\ExtensionProperties.dll\r\n\r\nBuild succeeded.\r\n    0 Warning(s)\r\n    0 Error(s)\r\n\r\nTime Elapsed 00:00:00.35\nRuntime: .NET 11.0.0-rc.2.26504.105\r\nPASS: extension property empty, mutation, clear, instance-member precedence and null rejection"
}
