{
  "kind": "compile-and-run",
  "sample": "samples/net10.0/FSharpAsync/FSharpAsync.fsproj",
  "target": "net10.0",
  "sdk": "10.0.402",
  "language": "10.0",
  "command": "C:\\Program Files\\dotnet\\dotnet.exe build FSharpAsync.fsproj --configuration Release -p:RestoreLockedMode=true; C:\\Program Files\\dotnet\\dotnet.exe V:\\_worktrees\\Playbook\\t3-16ef26d1\\samples\\net10.0\\FSharpAsync\\bin\\Release\\net10.0\\FSharpAsync.dll",
  "scope": "See recipe scope; output records only the commands actually performed.",
  "recordedAt": "2026-10-21T11:14:12.1338221+00:00",
  "sourceCommit": "599fae9cd6bb5548fb64e712b4c3ec45d3ec7972",
  "sourceDirty": true,
  "inputs": {
    "eng/Evidence.ps1": "ef7014f626c7cae314d7054331799671c79d9226c1a3eeaed0f912225eb172a2",
    "eng/Record-Evidence.ps1": "653a32b1ebe5be60a5489afd9a7a963dbbabf5c2ecfd47fe480974fd5d939498",
    "eng/Test-FSharpBoundaries.ps1": "0e7015afec963ad5bded326b59525ab37021b67fd00be97b9479bed42ea50960",
    "NuGet.Config": "aec93b5637ab6d62470979a008990a4a336a287ab83a3f2541849ae735674055",
    "samples/Directory.Build.props": "ac524510d3e5112332f8c69b4c7b367c90642848dfd249163bd084405502def6",
    "samples/Directory.Build.targets": "17284cb74605517cbec8a8153505da71a685b28694b67b5ef80608cd79b1c0ea",
    "samples/net10.0/FSharpAsync/AsyncWork.fs": "3516a93d4beb26912cdd7d4c0f78ac6f4cf0e1f95c25ea07cd2c114d8cb87d57",
    "samples/net10.0/FSharpAsync/Directory.Packages.props": "821868d3d34309485665217e538c69d2a46953b9c30a7f1053510e2b0fcc4dcf",
    "samples/net10.0/FSharpAsync/FSharpAsync.fsproj": "3f648d62b2741f3c901d38f569744f3847be6eed69bec68ff2e624ef1b77ae57",
    "samples/net10.0/FSharpAsync/global.json": "30fdf1d1d5cfadd6447ab39d18cc5eec405cf1a5ec5b2e4b1d228a6fe757846d",
    "samples/net10.0/FSharpAsync/packages.lock.json": "b0fae323c3083f23e6fdd0dc62d147f848a02d8e67b26f3df599ad5481313086",
    "samples/net10.0/FSharpAsync/verification.json": "1c3424eb27fc2d1d94b575d655b6075ca5b0906ebfd4d9e2f884ba85a8c051b7"
  },
  "dependencies": [
    "FSharp.Core/10.1.402"
  ],
  "workloads": [],
  "nativeToolchains": [],
  "host": "Microsoft Windows 10.0.26200 / X64",
  "sdkInfo": ".NET SDK:\r\n Version:           10.0.402\r\n Commit:            a8dd0577c5\r\n Workload version:  10.0.400-manifests.6055ec36\r\n MSBuild version:   18.9.15+a8dd0577c\r\n\r\nRuntime Environment:\r\n OS Name:     Windows\r\n OS Version:  10.0.26200\r\n OS Platform: Windows\r\n RID:         win-x64\r\n Base Path:   C:\\Program Files\\dotnet\\sdk\\10.0.402\\\r\n\r\n.NET workloads installed:\r\n [wasm-tools]\r\n   Installation Source: VS 18.11.12306.390\r\n   Manifest Version:    10.0.113/10.0.100\r\n   Manifest Path:       C:\\Program Files\\dotnet\\sdk-manifests\\10.0.100\\microsoft.net.workload.mono.toolchain.current\\10.0.113\\WorkloadManifest.json\r\n   Install Type:              Msi\r\n\r\n [maui-windows]\r\n   Installation Source: VS 18.11.12306.390\r\n   Manifest Version:    10.0.110/10.0.100\r\n   Manifest Path:       C:\\Program Files\\dotnet\\sdk-manifests\\10.0.100\\microsoft.net.sdk.maui\\10.0.110\\WorkloadManifest.json\r\n   Install Type:              Msi\r\n\r\n [maccatalyst]\r\n   Installation Source: VS 18.11.12306.390\r\n   Manifest Version:    26.5.10315/10.0.100\r\n   Manifest Path:       C:\\Program Files\\dotnet\\sdk-manifests\\10.0.100\\microsoft.net.sdk.maccatalyst\\26.5.10315\\WorkloadManifest.json\r\n   Install Type:              Msi\r\n\r\n [ios]\r\n   Installation Source: VS 18.11.12306.390\r\n   Manifest Version:    26.5.10315/10.0.100\r\n   Manifest Path:       C:\\Program Files\\dotnet\\sdk-manifests\\10.0.100\\microsoft.net.sdk.ios\\26.5.10315\\WorkloadManifest.json\r\n   Install Type:              Msi\r\n\r\n [android]\r\n   Installation Source: VS 18.11.12306.390\r\n   Manifest Version:    36.1.118/10.0.100\r\n   Manifest Path:       C:\\Program Files\\dotnet\\sdk-manifests\\10.0.100\\microsoft.net.sdk.android\\36.1.118\\WorkloadManifest.json\r\n   Install Type:              Msi\r\n\r\nConfigured to use workload sets when installing new manifests.\r\nNo workload sets are installed. Run \"dotnet workload restore\" to install a workload set.\r\n\r\nHost:\r\n  Version:      10.0.13\r\n  Architecture: x64\r\n  Commit:       4099f83977\r\n\r\n.NET SDKs installed:\r\n  10.0.300 [C:\\Program Files\\dotnet\\sdk]\r\n  10.0.402 [C:\\Program Files\\dotnet\\sdk]\r\n\r\n.NET runtimes installed:\r\n  Microsoft.AspNetCore.App 10.0.8 [C:\\Program Files\\dotnet\\shared\\Microsoft.AspNetCore.App]\r\n  Microsoft.AspNetCore.App 10.0.13 [C:\\Program Files\\dotnet\\shared\\Microsoft.AspNetCore.App]\r\n  Microsoft.NETCore.App 10.0.8 [C:\\Program Files\\dotnet\\shared\\Microsoft.NETCore.App]\r\n  Microsoft.NETCore.App 10.0.13 [C:\\Program Files\\dotnet\\shared\\Microsoft.NETCore.App]\r\n  Microsoft.WindowsDesktop.App 10.0.8 [C:\\Program Files\\dotnet\\shared\\Microsoft.WindowsDesktop.App]\r\n  Microsoft.WindowsDesktop.App 10.0.13 [C:\\Program Files\\dotnet\\shared\\Microsoft.WindowsDesktop.App]\r\n\r\nOther architectures found:\r\n  x86   [C:\\Program Files (x86)\\dotnet]\r\n    registered at [HKLM\\SOFTWARE\\dotnet\\Setup\\InstalledVersions\\x86\\InstallLocation]\r\n\r\nEnvironment variables:\r\n  DOTNET_ADD_GLOBAL_TOOLS_TO_PATH          [0]\r\n\r\nglobal.json file:\r\n  V:\\_worktrees\\Playbook\\t3-16ef26d1\\samples\\net10.0\\FSharpAsync\\global.json\r\n\r\nLearn more:\r\n  https://aka.ms/dotnet/info\r\n\r\nDownload .NET:\r\n  https://aka.ms/dotnet/download",
  "workloadInfo": "Workload version: 10.0.400-manifests.6055ec36\r\n\r\nInstalled Workload Id      Manifest Version         Installation Source\r\n-----------------------------------------------------------------------\r\nandroid                    36.1.118/10.0.100        VS 18.11.12306.390 \r\nios                        26.5.10315/10.0.100      VS 18.11.12306.390 \r\nmaccatalyst                26.5.10315/10.0.100      VS 18.11.12306.390 \r\nmaui-windows               10.0.110/10.0.100        VS 18.11.12306.390 \r\nwasm-tools                 10.0.113/10.0.100        VS 18.11.12306.390 \r\n\r\nUse `dotnet workload search` to find additional workloads to install.",
  "output": "Determining projects to restore...\r\n  Restored V:\\_worktrees\\Playbook\\t3-16ef26d1\\samples\\net10.0\\FSharpAsync\\FSharpAsync.fsproj (in 332 ms).\r\n  FSharpAsync -> V:\\_worktrees\\Playbook\\t3-16ef26d1\\samples\\net10.0\\FSharpAsync\\bin\\Release\\net10.0\\FSharpAsync.dll\r\n\r\nBuild succeeded.\r\n    0 Warning(s)\r\n    0 Error(s)\r\n\r\nTime Elapsed 00:00:04.30\nPASS: explicit synchronous prefix before the async runner\r\nPASS: async factories started=4 peak=2 results=[|10; 20; 30; 40|]\r\nPASS: task factories started=4 peak=2 results=[|10; 20; 30; 40|]"
}
