{
  "kind": "compile-and-run",
  "sample": "samples/net11.0/LanternTraces/LanternTraces.csproj",
  "target": "net11.0",
  "sdk": "11.0.100-rc.2.26504.105",
  "language": "15.0",
  "command": "C:\\Users\\pingu\\.dotnet-playbook-11\\dotnet.exe build LanternTraces.csproj --configuration Release -p:RestoreLockedMode=true; C:\\Users\\pingu\\.dotnet-playbook-11\\dotnet.exe V:\\_worktrees\\Playbook\\t3-a14a0e20\\samples\\net11.0\\LanternTraces\\bin\\Release\\net11.0\\LanternTraces.dll",
  "scope": "See recipe scope; output records only the commands actually performed.",
  "recordedAt": "2026-10-28T14:36:37.3544046+00:00",
  "sourceCommit": "493677243f87f67fe2f5bdd46e53eb3f0c025084",
  "sourceDirty": true,
  "inputs": {
    ".editorconfig": "c99359640a7ebc05cb7e8246fa002e9cd12b3b10bc7773f1af574391e8e94664",
    "eng/Evidence.ps1": "b3dbd6b3788e31aefe1533ef89fed66625f2a637993f9291e8d1d4fc8a2ba849",
    "eng/Record-Evidence.ps1": "653a32b1ebe5be60a5489afd9a7a963dbbabf5c2ecfd47fe480974fd5d939498",
    "NuGet.Config": "aec93b5637ab6d62470979a008990a4a336a287ab83a3f2541849ae735674055",
    "samples/net11.0/LanternTraces/Directory.Build.props": "347e2e29465c6a37869dd07b0b401c55743b8571fb513a4e42b6ee8facc06ca4",
    "samples/net11.0/LanternTraces/Directory.Build.targets": "347e2e29465c6a37869dd07b0b401c55743b8571fb513a4e42b6ee8facc06ca4",
    "samples/net11.0/LanternTraces/Directory.Packages.props": "c9c33a7ac7a6af80f7bc8c091069baaf4e7aa6dd3b2d07764d28b4cea4558d60",
    "samples/net11.0/LanternTraces/global.json": "7bb56d5a448af37906c78d0644283e0ba955324cb4bc5ead213a494f0a4bd795",
    "samples/net11.0/LanternTraces/LanternTraces.csproj": "e81324f242bf0cb053d863aa7d850b5abedd0bc62518d072918650f198081d31",
    "samples/net11.0/LanternTraces/packages.lock.json": "45ceb5ab1c1f799343266cccad2a16051014b47698367fef6a201fd6eb8acc9b",
    "samples/net11.0/LanternTraces/Program.cs": "2bb20622da70bd4e8baeb70d6e188c6901e73e6e370b6444b07337da62d6ff65",
    "samples/net11.0/LanternTraces/verification.json": "a5d45717a55a28201c423722399e84898cad204dce12594088296071002b9b35"
  },
  "dependencies": [
    "OpenTelemetry.Api.ProviderBuilderExtensions/1.20.1",
    "OpenTelemetry.Api/1.20.1",
    "OpenTelemetry/1.20.1"
  ],
  "workloads": [],
  "nativeToolchains": [],
  "host": "Microsoft Windows 10.0.26200 / X64",
  "sdkInfo": ".NET SDK:\r\n Version:           11.0.100-rc.2.26504.105\r\n Commit:            820230c386\r\n Workload version:  11.0.100-manifests.4d7a54d2\r\n MSBuild version:   18.12.0-1.26504.105+820230c38\r\n\r\nRuntime Environment:\r\n OS Name:     Windows\r\n OS Version:  10.0.26200\r\n OS Platform: Windows\r\n RID:         win-x64\r\n Base Path:   C:\\Users\\pingu\\.dotnet-playbook-11\\sdk\\11.0.100-rc.2.26504.105\r\n\r\n.NET workloads installed:\r\n [wasm-tools]\r\n   Installation Source: VS 18.11.12306.390\r\n   Manifest Version:    11.0.100-rc.2.26504.105/11.0.100-rc.2\r\n   Manifest Path:       C:\\Users\\pingu\\.dotnet-playbook-11\\sdk-manifests\\11.0.100-rc.2\\microsoft.net.workload.mono.toolchain.current\\11.0.100-rc.2.26504.105\\WorkloadManifest.json\r\n   Install Type:        FileBased\r\n\r\n [maui-windows]\r\n   Installation Source: VS 18.11.12306.390\r\n   Manifest Version:    11.0.0-preview.6.26360.8/11.0.100-preview.6\r\n   Manifest Path:       C:\\Users\\pingu\\.dotnet-playbook-11\\sdk-manifests\\11.0.100-preview.6\\microsoft.net.sdk.maui\\11.0.0-preview.6.26360.8\\WorkloadManifest.json\r\n   Install Type:        FileBased\r\n\r\n [maccatalyst]\r\n   Installation Source: VS 18.11.12306.390\r\n   Manifest Version:    26.5.11720-net11-p6/11.0.100-preview.6\r\n   Manifest Path:       C:\\Users\\pingu\\.dotnet-playbook-11\\sdk-manifests\\11.0.100-preview.6\\microsoft.net.sdk.maccatalyst\\26.5.11720-net11-p6\\WorkloadManifest.json\r\n   Install Type:        FileBased\r\n\r\n [ios]\r\n   Installation Source: VS 18.11.12306.390\r\n   Manifest Version:    26.5.11720-net11-p6/11.0.100-preview.6\r\n   Manifest Path:       C:\\Users\\pingu\\.dotnet-playbook-11\\sdk-manifests\\11.0.100-preview.6\\microsoft.net.sdk.ios\\26.5.11720-net11-p6\\WorkloadManifest.json\r\n   Install Type:        FileBased\r\n\r\n [android]\r\n   Installation Source: VS 18.11.12306.390\r\n   Manifest Version:    37.0.0-preview.6.59/11.0.100-preview.6\r\n   Manifest Path:       C:\\Users\\pingu\\.dotnet-playbook-11\\sdk-manifests\\11.0.100-preview.6\\microsoft.net.sdk.android\\37.0.0-preview.6.59\\WorkloadManifest.json\r\n   Install Type:        FileBased\r\n\r\nConfigured to use workload sets when installing new manifests.\r\nNo workload sets are installed. Run \"dotnet workload restore\" to install a workload set.\r\n\r\nHost:\r\n  Version:      11.0.0-rc.2.26504.105\r\n  Architecture: x64\r\n  Commit:       820230c386\r\n\r\n.NET SDKs installed:\r\n  11.0.100-rc.2.26504.105 [C:\\Users\\pingu\\.dotnet-playbook-11\\sdk]\r\n\r\n.NET runtimes installed:\r\n  Microsoft.AspNetCore.App 11.0.0-rc.2.26504.105 [C:\\Users\\pingu\\.dotnet-playbook-11\\shared\\Microsoft.AspNetCore.App]\r\n  Microsoft.NETCore.App 11.0.0-rc.2.26504.105 [C:\\Users\\pingu\\.dotnet-playbook-11\\shared\\Microsoft.NETCore.App]\r\n  Microsoft.WindowsDesktop.App 11.0.0-rc.2.26504.105 [C:\\Users\\pingu\\.dotnet-playbook-11\\shared\\Microsoft.WindowsDesktop.App]\r\n\r\nOther architectures found:\r\n  x86   [C:\\Program Files (x86)\\dotnet]\r\n    registered at [HKLM\\SOFTWARE\\dotnet\\Setup\\InstalledVersions\\x86\\InstallLocation]\r\n\r\nEnvironment variables:\r\n  DOTNET_ADD_GLOBAL_TOOLS_TO_PATH          [0]\r\n  DOTNET_ROOT                              [C:\\Users\\pingu\\AppData\\Local\\dotnetup\\dotnet]\r\n\r\nglobal.json file:\r\n  V:\\_worktrees\\Playbook\\t3-a14a0e20\\samples\\net11.0\\LanternTraces\\global.json\r\n\r\nLearn more:\r\n  https://aka.ms/dotnet/info\r\n\r\nDownload .NET:\r\n  https://aka.ms/dotnet/download",
  "workloadInfo": "Workload version: 11.0.100-manifests.4d7a54d2\r\n\r\nInstalled Workload Id      Manifest Version                                 Installation Source\r\n-----------------------------------------------------------------------------------------------\r\nandroid                    37.0.0-preview.6.59/11.0.100-preview.6           VS 18.11.12306.390 \r\nios                        26.5.11720-net11-p6/11.0.100-preview.6           VS 18.11.12306.390 \r\nmaccatalyst                26.5.11720-net11-p6/11.0.100-preview.6           VS 18.11.12306.390 \r\nmaui-windows               11.0.0-preview.6.26360.8/11.0.100-preview.6      VS 18.11.12306.390 \r\nwasm-tools                 11.0.100-rc.2.26504.105/11.0.100-rc.2            VS 18.11.12306.390 \r\n\r\nUse `dotnet workload search` to find additional workloads to install.",
  "output": "Determining projects to restore...\r\n  All projects are up-to-date for restore.\r\nC:\\Users\\pingu\\.dotnet-playbook-11\\sdk\\11.0.100-rc.2.26504.105\\Sdks\\Microsoft.NET.Sdk\\targets\\Microsoft.NET.RuntimeIdentifierInference.targets(385,5): message NETSDK1057: You are using a preview version of .NET. See: https://aka.ms/dotnet-support-policy [V:\\_worktrees\\Playbook\\t3-a14a0e20\\samples\\net11.0\\LanternTraces\\LanternTraces.csproj]\r\n  LanternTraces -> V:\\_worktrees\\Playbook\\t3-a14a0e20\\samples\\net11.0\\LanternTraces\\bin\\Release\\net11.0\\LanternTraces.dll\r\n\r\nBuild succeeded.\r\n    0 Warning(s)\r\n    0 Error(s)\r\n\r\nTime Elapsed 00:00:00.30\nSPAN source=Microsoft.AspNetCore route=Station/Index/{id?} status=Unset description=<null> method=GET response=200\r\nSPAN source=Microsoft.AspNetCore route=Station/Fault/{id?} status=Error description=<null> method=GET response=500\r\nPASS .NET 11.0.0-rc.2.26504.105: two real requests, two exported native server spans; suppress=False; domain enrichment only; no AspNetCore instrumentation dependency.\r\nSPAN source=Microsoft.AspNetCore route= status=Unset description=<null> method=<suppressed> response=<suppressed>\r\nSPAN source=Microsoft.AspNetCore route= status=Unset description=<null> method=<suppressed> response=<suppressed>\r\nPASS .NET 11.0.0-rc.2.26504.105: two real requests, two exported native server spans; suppress=True; domain enrichment only; no AspNetCore instrumentation dependency."
}
